<?xml version="1.0"?>
<!DOCTYPE RegisterMap SYSTEM "../../../../fpga/registers/dtd/RegMap.dtd">
<RegisterMap version="1.0">

 	<Device name="FPGA">

 		<Feature name="Antenna" comment="Antenna registers">
			<xinclude:include  href="../../../../fpga/registers/xml/Antenna.xml#Antenna"/>
 		</Feature>

 		<Feature name="Chain" comment="Chain IQ registers">
			<xinclude:include  href="../../../../fpga/registers/xml/Chain.xml#Chain"/>
 		</Feature>

 		<Feature name="Fibre" comment="Fibre registers">
			<xinclude:include  href="../../../../fpga/registers/xml/Fibre.xml#Fibre"/>
 		</Feature>

 		<Feature name="Iq" comment="Fibre IQ registers">
			<xinclude:include  href="../../../../fpga/registers/xml/Iq.xml#Iq"/>
 		</Feature>

 		<Feature name="Msk" comment="MSK registers">
			<xinclude:include  href="../../../../fpga/registers/xml/Msk.xml#Msk"/>
 		</Feature>

 		<Feature name="System" comment="System registers">
			<xinclude:include  href="../../../../fpga/registers/xml/System.xml#System"/>
			<xinclude:include  href="../../../../fpga/registers/xml/System.xml#RF_Chain_Registers"/>
 		</Feature>

 		<Feature name="Tone" comment="Tone registers">
			<xinclude:include  href="../../../../fpga/registers/xml/Tone.xml#Tone"/>
 		</Feature>

 		<Feature name="Waveform" comment="Waveform registers">
			<xinclude:include  href="../../../../fpga/registers/xml/System.xml#SystemWaveform"/>
			<xinclude:include  href="../../../../fpga/registers/xml/Waveform.xml#Waveform"/>
 		</Feature>

	</Device>

</RegisterMap>

